{"authority":{"role":"non_authoritative_source_snapshot","rules":["preserve source evidence without adjudicating truth","absence is not a negative finding","normalization and learning happen under separate governed stages"]},"commits":[{"author_date":"2026-08-30T10:56:00Z","committer_date":"2026-08-30T10:56:00Z","html_url":"https://github.com/BogdanAIP/uv-studio/commit/a967c1e16ccf6bb3369e2e794df48147ea200970","message":"chore: start project identity v2 slice","parents":["52be1939eca51d7147990288cfc6258b023c2cd2"],"sha":"a967c1e16ccf6bb3369e2e794df48147ea200970"},{"author_date":"2026-08-30T10:56:23Z","committer_date":"2026-08-30T10:56:23Z","html_url":"https://github.com/BogdanAIP/uv-studio/commit/34083ddfd9faa585abe3a79e605b4e860630fc8b","message":"chore: bind project identity slice to PR 88","parents":["a967c1e16ccf6bb3369e2e794df48147ea200970"],"sha":"34083ddfd9faa585abe3a79e605b4e860630fc8b"},{"author_date":"2026-08-30T10:56:41Z","committer_date":"2026-08-30T10:56:41Z","html_url":"https://github.com/BogdanAIP/uv-studio/commit/b74f9dd29dc8250d155578e6257dd060e146404a","message":"docs: record active project identity v2 slice","parents":["34083ddfd9faa585abe3a79e605b4e860630fc8b"],"sha":"b74f9dd29dc8250d155578e6257dd060e146404a"},{"author_date":"2026-08-30T10:59:33Z","committer_date":"2026-08-30T10:59:33Z","html_url":"https://github.com/BogdanAIP/uv-studio/commit/31751b17210237acdacb2b64cf0cc0827316020b","message":"feat: add Project schema v2 compatibility state","parents":["b74f9dd29dc8250d155578e6257dd060e146404a"],"sha":"31751b17210237acdacb2b64cf0cc0827316020b"},{"author_date":"2026-08-30T10:59:47Z","committer_date":"2026-08-30T10:59:47Z","html_url":"https://github.com/BogdanAIP/uv-studio/commit/8979975d89d6870ab285abbfac264e45fe9e0dce","message":"feat: migrate schema v1 recipe identity","parents":["31751b17210237acdacb2b64cf0cc0827316020b"],"sha":"8979975d89d6870ab285abbfac264e45fe9e0dce"},{"author_date":"2026-08-30T11:00:11Z","committer_date":"2026-08-30T11:00:11Z","html_url":"https://github.com/BogdanAIP/uv-studio/commit/c912f73e91eeb0dd5dce3bc63e6916ae1c081932","message":"refactor: read recipe identity through compatibility boundary","parents":["8979975d89d6870ab285abbfac264e45fe9e0dce"],"sha":"c912f73e91eeb0dd5dce3bc63e6916ae1c081932"},{"author_date":"2026-08-30T11:00:22Z","committer_date":"2026-08-30T11:00:22Z","html_url":"https://github.com/BogdanAIP/uv-studio/commit/9978a60d01aef570d553a63ac620575a52f31bcc","message":"refactor: keep recipe API payload compatibility explicit","parents":["c912f73e91eeb0dd5dce3bc63e6916ae1c081932"],"sha":"9978a60d01aef570d553a63ac620575a52f31bcc"},{"author_date":"2026-08-30T11:01:35Z","committer_date":"2026-08-30T11:01:35Z","html_url":"https://github.com/BogdanAIP/uv-studio/commit/1e047e09511ec788631418954d150867c26b69b5","message":"fix: bind archive manifest to stored project schema","parents":["9978a60d01aef570d553a63ac620575a52f31bcc"],"sha":"1e047e09511ec788631418954d150867c26b69b5"},{"author_date":"2026-08-30T11:02:27Z","committer_date":"2026-08-30T11:02:27Z","html_url":"https://github.com/BogdanAIP/uv-studio/commit/04b36af8e81b7ee4d8700d34862fe7a5a7468919","message":"test: prove Project v1 to v2 compatibility migration","parents":["1e047e09511ec788631418954d150867c26b69b5"],"sha":"04b36af8e81b7ee4d8700d34862fe7a5a7468919"},{"author_date":"2026-08-30T11:02:54Z","committer_date":"2026-08-30T11:02:54Z","html_url":"https://github.com/BogdanAIP/uv-studio/commit/2499baa6c657fc24cfaef08afc0dc4bda2cca6b1","message":"test: prove identity reads compatibility state","parents":["04b36af8e81b7ee4d8700d34862fe7a5a7468919"],"sha":"2499baa6c657fc24cfaef08afc0dc4bda2cca6b1"},{"author_date":"2026-08-30T11:03:30Z","committer_date":"2026-08-30T11:03:30Z","html_url":"https://github.com/BogdanAIP/uv-studio/commit/6f91e9f54d2a575e25f965620a441c6fcafcd284","message":"test: prove schema v1 archive compatibility","parents":["2499baa6c657fc24cfaef08afc0dc4bda2cca6b1"],"sha":"6f91e9f54d2a575e25f965620a441c6fcafcd284"},{"author_date":"2026-08-30T11:04:13Z","committer_date":"2026-08-30T11:04:13Z","html_url":"https://github.com/BogdanAIP/uv-studio/commit/22d1d832363cbdcac1483a85fe0a5db838a120c4","message":"chore: classify project identity work as stage","parents":["6f91e9f54d2a575e25f965620a441c6fcafcd284"],"sha":"22d1d832363cbdcac1483a85fe0a5db838a120c4"},{"author_date":"2026-08-30T11:15:30Z","committer_date":"2026-08-30T11:15:30Z","html_url":"https://github.com/BogdanAIP/uv-studio/commit/22cbaf5abbf0663fdb918adf938b20e600802af3","message":"chore: extend slice scope for Project API v2 contract","parents":["22d1d832363cbdcac1483a85fe0a5db838a120c4"],"sha":"22cbaf5abbf0663fdb918adf938b20e600802af3"},{"author_date":"2026-08-30T11:15:52Z","committer_date":"2026-08-30T11:15:52Z","html_url":"https://github.com/BogdanAIP/uv-studio/commit/f2c101364b49f883a212340c0d54897b73ea79e4","message":"test: update Project API contract for schema v2","parents":["22cbaf5abbf0663fdb918adf938b20e600802af3"],"sha":"f2c101364b49f883a212340c0d54897b73ea79e4"}],"issue_comments":[],"issue_reactions":[],"pr_number":88,"pull_request":{"base":{"ref":"main","repo":"BogdanAIP/uv-studio","repo_id":1329787546,"repo_node_id":"R_kgDOT0Lymg","sha":"52be1939eca51d7147990288cfc6258b023c2cd2"},"body":"Superseded before review by the same implementation moved to the repository-required `stage-N/...` branch naming contract. No code from this PR is intended to merge.","closed_at":"2026-08-30T11:19:08Z","created_at":"2026-08-30T10:56:11Z","draft":true,"head":{"ref":"feat/project-identity-v2-compat-reader","repo":"BogdanAIP/uv-studio","repo_id":1329787546,"repo_node_id":"R_kgDOT0Lymg","sha":"f2c101364b49f883a212340c0d54897b73ea79e4"},"html_url":"https://github.com/BogdanAIP/uv-studio/pull/88","id":4395482008,"locked":false,"merge_commit_sha":null,"merged_at":null,"node_id":"PR_kwDOT0Lyms8AAAABBf27mA","number":88,"state":"closed","title":"feat: add Project v2 compatibility identity","updated_at":"2026-08-30T11:19:08Z","user":{"id":225327645,"login":"BogdanAIP","type":"User"}},"repository":"BogdanAIP/uv-studio","repository_id":1329787546,"repository_node_id":"R_kgDOT0Lymg","review_comments":[],"reviews":[],"schema_version":"github_pr_evidence_snapshot_v1","source":{"api_base":"https://api.github.com","pull_request_url":"https://github.com/BogdanAIP/uv-studio/pull/88"}}
