{"authority":{"role":"non_authoritative_source_snapshot","rules":["preserve source evidence without adjudicating truth","absence is not a negative finding","normalization and learning happen under separate governed stages"]},"commits":[{"author_date":"2026-08-30T16:45:43Z","committer_date":"2026-08-30T16:45:43Z","html_url":"https://github.com/BogdanAIP/chat-agent-platform/commit/98728970be0b63952fe7c2e0dcf739a8b3f0220c","message":"Bump @playwright/mcp\n\nBumps the semantic-npm-non-major group with 1 update in the /runtime/semantic-projection directory: [@playwright/mcp](https://github.com/microsoft/playwright-mcp).\n\n\nUpdates `@playwright/mcp` from 0.0.78 to 0.0.79\n- [Release notes](https://github.com/microsoft/playwright-mcp/releases)\n- [Commits](https://github.com/microsoft/playwright-mcp/compare/v0.0.78...v0.0.79)\n\n---\nupdated-dependencies:\n- dependency-name: \"@playwright/mcp\"\n  dependency-version: 0.0.79\n  dependency-type: direct:production\n  update-type: version-update:semver-patch\n  dependency-group: semantic-npm-non-major\n...\n\nSigned-off-by: dependabot[bot] <support@github.com>","parents":["d99ec89267de59c5a4b17ffecb4c2989ded9b9e0"],"sha":"98728970be0b63952fe7c2e0dcf739a8b3f0220c"}],"issue_comments":[{"author_association":"CONTRIBUTOR","body":"Looks like @playwright/mcp is updatable in another way, so this is no longer needed.","created_at":"2026-09-01T07:35:03Z","html_url":"https://github.com/BogdanAIP/chat-agent-platform/pull/75#issuecomment-5490529983","id":5490529983,"node_id":"IC_kwDOTxIjVc8AAAABR0LWvw","reactions":{"+1":0,"-1":0,"confused":0,"eyes":0,"heart":0,"hooray":0,"laugh":0,"rocket":0,"total_count":0,"url":"https://api.github.com/repos/BogdanAIP/chat-agent-platform/issues/comments/5490529983/reactions"},"updated_at":"2026-09-01T07:35:03Z","user":{"id":49699333,"login":"dependabot[bot]","type":"Bot"}}],"issue_reactions":[],"pr_number":75,"pull_request":{"base":{"ref":"main","repo":"BogdanAIP/chat-agent-platform","repo_id":1326588757,"repo_node_id":"R_kgDOTxIjVQ","sha":"d99ec89267de59c5a4b17ffecb4c2989ded9b9e0"},"body":"Bumps the semantic-npm-non-major group with 1 update in the /runtime/semantic-projection directory: [@playwright/mcp](https://github.com/microsoft/playwright-mcp).\n\nUpdates `@playwright/mcp` from 0.0.78 to 0.0.79\n<details>\n<summary>Release notes</summary>\n<p><em>Sourced from <a href=\"https://github.com/microsoft/playwright-mcp/releases\">@​playwright/mcp's releases</a>.</em></p>\n<blockquote>\n<h2>v0.0.79</h2>\n<h2>What's New</h2>\n<h3>Tool Improvements</h3>\n<ul>\n<li><strong><code>browser_take_screenshot</code> — WebP format</strong> — New <code>type</code> option to pick the image format (<code>png</code>, <code>jpeg</code> or <code>webp</code>); when unset, the format is inferred from the filename extension (<a href=\"https://redirect.github.com/microsoft/playwright/pull/41152\">#41152</a>)</li>\n<li><strong><code>--codegen</code> — more languages</strong> — Code generation now supports <code>python</code>, <code>java</code> and <code>csharp</code> in addition to <code>typescript</code> (<a href=\"https://redirect.github.com/microsoft/playwright/pull/42106\">#42106</a>)</li>\n<li><strong>Configurable settle delay</strong> — New <code>--timeout-settle</code> flag (and <code>timeouts.settle</code> config option) to control how long to wait after each action for triggered work (navigations, requests) to settle, defaults to 500ms (<a href=\"https://redirect.github.com/microsoft/playwright/pull/41924\">#41924</a>)</li>\n</ul>\n<h2>Fixes</h2>\n<ul>\n<li>Aria snapshot capture is skipped when the response discards it (<a href=\"https://redirect.github.com/microsoft/playwright/pull/41923\">#41923</a>)</li>\n<li>New <code>--snapshot-boxes</code> flag (and <code>snapshot.boxes</code> config option) to enable bounding boxes in snapshots globally — previously this was only available per command (<a href=\"https://redirect.github.com/microsoft/playwright/pull/42102\">#42102</a>)</li>\n<li>Reconnect to the browser after a disconnect (<a href=\"https://redirect.github.com/microsoft/playwright/pull/41966\">#41966</a>)</li>\n<li>Report malformed JSON config instead of silently falling back to INI parsing (<a href=\"https://redirect.github.com/microsoft/playwright/pull/41909\">#41909</a>)</li>\n<li>Clear the dialog modal state when a dialog is closed out of band (<a href=\"https://redirect.github.com/microsoft/playwright/pull/42032\">#42032</a>)</li>\n<li>Detect downloads via the download event instead of guessing from <code>net::ERR_ABORTED</code> navigation errors (<a href=\"https://redirect.github.com/microsoft/playwright/pull/41933\">#41933</a>)</li>\n<li>Surface the missing executable path when a browser isn't installed (<a href=\"https://redirect.github.com/microsoft/playwright/pull/41941\">#41941</a>)</li>\n<li>Escape user input in codegen output (<a href=\"https://redirect.github.com/microsoft/playwright/pull/41962\">#41962</a>)</li>\n<li>Removed the stale <code>--output-mode</code> CLI option (<a href=\"https://redirect.github.com/microsoft/playwright/pull/41833\">#41833</a>)</li>\n</ul>\n<h3>Browser Extension</h3>\n<ul>\n<li>Validate <code>Host</code> and <code>Origin</code> headers on CDP relay WebSocket upgrades (<a href=\"https://redirect.github.com/microsoft/playwright/pull/42103\">#42103</a>)</li>\n<li>Launch the Chrome profile that has the extension installed (<a href=\"https://redirect.github.com/microsoft/playwright/pull/41939\">#41939</a>)</li>\n<li>Pass <code>noDefaults</code> for extension CDP connections (<a href=\"https://redirect.github.com/microsoft/playwright/pull/42119\">#42119</a>)</li>\n<li>Mention <code>PLAYWRIGHT_MCP_EXECUTABLE_PATH</code> in the error shown when the browser executable is not found (<a href=\"https://redirect.github.com/microsoft/playwright/pull/42122\">#42122</a>)</li>\n<li>Removed support for extension protocol v1 (<a href=\"https://redirect.github.com/microsoft/playwright/pull/41857\">#41857</a>)</li>\n</ul>\n</blockquote>\n</details>\n<details>\n<summary>Commits</summary>\n<ul>\n<li><a href=\"https://github.com/microsoft/playwright-mcp/commit/4c5077651542f68525a0b51e97bab2a32abc9290\"><code>4c50776</code></a> chore: mark v0.0.79 (<a href=\"https://redirect.github.com/microsoft/playwright-mcp/issues/1707\">#1707</a>)</li>\n<li><a href=\"https://github.com/microsoft/playwright-mcp/commit/4ed35bf8713337dfce02f073edd3bd0c7ebf310f\"><code>4ed35bf</code></a> chore: roll Playwright to 1.63.0-alpha-2026-08-05 (<a href=\"https://redirect.github.com/microsoft/playwright-mcp/issues/1706\">#1706</a>)</li>\n<li><a href=\"https://github.com/microsoft/playwright-mcp/commit/8414d571beed0e12a4b8c7f537bfdab44236ba4c\"><code>8414d57</code></a> chore(deps): bump <code>@​hono/node-server</code> and <code>@​modelcontextprotocol/sdk</code> (<a href=\"https://redirect.github.com/microsoft/playwright-mcp/issues/1702\">#1702</a>)</li>\n<li><a href=\"https://github.com/microsoft/playwright-mcp/commit/f2db2c2faa25df3015d8aac8d843afa50a55971c\"><code>f2db2c2</code></a> chore(deps-dev): bump ip-address from 10.2.0 to 10.4.0 (<a href=\"https://redirect.github.com/microsoft/playwright-mcp/issues/1703\">#1703</a>)</li>\n<li><a href=\"https://github.com/microsoft/playwright-mcp/commit/42e792a40faae2d99e51c9a190f8b016bd6ef0b2\"><code>42e792a</code></a> chore(deps-dev): bump hono from 4.12.26 to 4.12.31 (<a href=\"https://redirect.github.com/microsoft/playwright-mcp/issues/1687\">#1687</a>)</li>\n<li><a href=\"https://github.com/microsoft/playwright-mcp/commit/30710c8a5cf235649cb6d6c50eaad5187290b450\"><code>30710c8</code></a> chore(deps-dev): bump fast-uri from 3.1.2 to 3.1.4 (<a href=\"https://redirect.github.com/microsoft/playwright-mcp/issues/1692\">#1692</a>)</li>\n<li><a href=\"https://github.com/microsoft/playwright-mcp/commit/55679f5f3d4b4f3e2534ec0ce2fc5683ba2eaf3f\"><code>55679f5</code></a> fix: readme typo, update devcontainer playwright version, remove shebang from...</li>\n<li>See full diff in <a href=\"https://github.com/microsoft/playwright-mcp/compare/v0.0.78...v0.0.79\">compare view</a></li>\n</ul>\n</details>\n<br />","closed_at":"2026-09-01T07:35:05Z","created_at":"2026-08-17T18:35:36Z","draft":false,"head":{"ref":"dependabot/npm_and_yarn/runtime/semantic-projection/semantic-npm-non-major-16e62eb555","repo":"BogdanAIP/chat-agent-platform","repo_id":1326588757,"repo_node_id":"R_kgDOTxIjVQ","sha":"98728970be0b63952fe7c2e0dcf739a8b3f0220c"},"html_url":"https://github.com/BogdanAIP/chat-agent-platform/pull/75","id":4298258176,"locked":false,"merge_commit_sha":null,"merged_at":null,"node_id":"PR_kwDOTxIjVc8AAAABADI3AA","number":75,"state":"closed","title":"Bump @playwright/mcp from 0.0.78 to 0.0.79 in /runtime/semantic-projection in the semantic-npm-non-major group across 1 directory","updated_at":"2026-09-01T07:35:07Z","user":{"id":49699333,"login":"dependabot[bot]","type":"Bot"}},"repository":"BogdanAIP/chat-agent-platform","repository_id":1326588757,"repository_node_id":"R_kgDOTxIjVQ","review_comments":[],"reviews":[],"schema_version":"github_pr_evidence_snapshot_v1","source":{"api_base":"https://api.github.com","pull_request_url":"https://github.com/BogdanAIP/chat-agent-platform/pull/75"}}
