{"authority":{"role":"non_authoritative_source_snapshot","rules":["preserve source evidence without adjudicating truth","absence is not a negative finding","normalization and learning happen under separate governed stages"]},"commits":[{"author_date":"2026-09-12T21:54:43Z","committer_date":"2026-09-12T21:54:43Z","html_url":"https://github.com/BogdanAIP/chat-agent-platform/commit/8ebf85f3942af74be2416a39126ca8ab3535ca30","message":"Docs: freeze delegation provider contract boundary","parents":["cdc7bc5d92ee98e9c036d8332ecfff0232c293b4"],"sha":"8ebf85f3942af74be2416a39126ca8ab3535ca30"},{"author_date":"2026-09-12T22:29:21Z","committer_date":"2026-09-12T22:29:21Z","html_url":"https://github.com/BogdanAIP/chat-agent-platform/commit/2d028fa2006560d9f8c24bfee6ecedbfcf09878b","message":"Docs: refine delegation boundary terminology","parents":["8ebf85f3942af74be2416a39126ca8ab3535ca30"],"sha":"2d028fa2006560d9f8c24bfee6ecedbfcf09878b"}],"issue_comments":[{"author_association":"NONE","body":"You have reached your Codex usage limits for code reviews. You can see your limits in the [Codex usage dashboard](https://chatgpt.com/codex/cloud/settings/usage).\nTo continue using code reviews, you can upgrade your account or add credits to your account and enable them for code reviews in your [settings](https://chatgpt.com/codex/cloud/settings/code-review).","created_at":"2026-09-12T22:34:41Z","html_url":"https://github.com/BogdanAIP/chat-agent-platform/pull/155#issuecomment-5649139922","id":5649139922,"node_id":"IC_kwDOTxIjVc8AAAABULcI0g","reactions":{"+1":0,"-1":0,"confused":0,"eyes":0,"heart":0,"hooray":0,"laugh":0,"rocket":0,"total_count":0,"url":"https://api.github.com/repos/BogdanAIP/chat-agent-platform/issues/comments/5649139922/reactions"},"updated_at":"2026-09-12T22:34:41Z","user":{"id":199175422,"login":"chatgpt-codex-connector[bot]","type":"Bot"}}],"issue_reactions":[],"pr_number":155,"pull_request":{"base":{"ref":"main","repo":"BogdanAIP/chat-agent-platform","repo_id":1326588757,"repo_node_id":"R_kgDOTxIjVQ","sha":"cdc7bc5d92ee98e9c036d8332ecfff0232c293b4"},"body":"This PR does not change runtime behavior.\n\nIt extracts the implicit delegation boundary already present after Agent Session work into an explicit architectural contract.\n\nGoals:\n- separate CAP-owned trust semantics from provider mechanics;\n- define Provider Result vs Verified Effect boundary;\n- prepare future provider compatibility checks without adding a new runtime.\n\nNo scheduler, multi-agent runtime, or provider-specific expansion is introduced.","closed_at":"2026-09-12T22:34:52Z","created_at":"2026-09-12T21:54:54Z","draft":false,"head":{"ref":"architecture/delegation-contract-freeze","repo":"BogdanAIP/chat-agent-platform","repo_id":1326588757,"repo_node_id":"R_kgDOTxIjVQ","sha":"2d028fa2006560d9f8c24bfee6ecedbfcf09878b"},"html_url":"https://github.com/BogdanAIP/chat-agent-platform/pull/155","id":4515639128,"locked":false,"merge_commit_sha":null,"merged_at":"2026-09-12T22:34:52Z","node_id":"PR_kwDOTxIjVc8AAAABDScvWA","number":155,"state":"closed","title":"Docs: freeze delegation provider contract boundary","updated_at":"2026-09-12T22:34:52Z","user":{"id":225327645,"login":"BogdanAIP","type":"User"}},"repository":"BogdanAIP/chat-agent-platform","repository_id":1326588757,"repository_node_id":"R_kgDOTxIjVQ","review_comments":[],"reviews":[],"schema_version":"github_pr_evidence_snapshot_v1","source":{"api_base":"https://api.github.com","pull_request_url":"https://github.com/BogdanAIP/chat-agent-platform/pull/155"}}
