{"authority":{"role":"non_authoritative_source_snapshot","rules":["preserve source evidence without adjudicating truth","absence is not a negative finding","normalization and learning happen under separate governed stages"]},"commits":[{"author_date":"2026-09-23T13:49:52Z","committer_date":"2026-09-23T13:49:52Z","html_url":"https://github.com/BogdanAIP/chat-agent-platform/commit/b80f3d987cf2b0ca7a5fe9654dcdae0cefb70618","message":"Core: extract semantic provider bindings","parents":["c9fce847c0712ac913d6cb49787f892c11514fbb"],"sha":"b80f3d987cf2b0ca7a5fe9654dcdae0cefb70618"},{"author_date":"2026-09-23T13:50:14Z","committer_date":"2026-09-23T13:50:14Z","html_url":"https://github.com/BogdanAIP/chat-agent-platform/commit/87f8f1fbddc385133e0074152c49f4e316f6e3bc","message":"Core: route semantic providers through explicit seams","parents":["b80f3d987cf2b0ca7a5fe9654dcdae0cefb70618"],"sha":"87f8f1fbddc385133e0074152c49f4e316f6e3bc"},{"author_date":"2026-09-23T13:50:36Z","committer_date":"2026-09-23T13:50:36Z","html_url":"https://github.com/BogdanAIP/chat-agent-platform/commit/e56a5bd708287e48b2f78b65860b6da8c209a7d4","message":"Test semantic provider seam boundary","parents":["87f8f1fbddc385133e0074152c49f4e316f6e3bc"],"sha":"e56a5bd708287e48b2f78b65860b6da8c209a7d4"},{"author_date":"2026-09-23T13:50:54Z","committer_date":"2026-09-23T13:50:54Z","html_url":"https://github.com/BogdanAIP/chat-agent-platform/commit/b28b47b625e33a266b616294dc510691d89fa3b7","message":"Package semantic provider seam","parents":["e56a5bd708287e48b2f78b65860b6da8c209a7d4"],"sha":"b28b47b625e33a266b616294dc510691d89fa3b7"},{"author_date":"2026-09-23T13:51:19Z","committer_date":"2026-09-23T13:51:19Z","html_url":"https://github.com/BogdanAIP/chat-agent-platform/commit/1ebb6f0d28361362725ce6885d931f566278ae20","message":"Install semantic provider seam in acceptance layout","parents":["b28b47b625e33a266b616294dc510691d89fa3b7"],"sha":"1ebb6f0d28361362725ce6885d931f566278ae20"},{"author_date":"2026-09-23T13:51:54Z","committer_date":"2026-09-23T13:51:54Z","html_url":"https://github.com/BogdanAIP/chat-agent-platform/commit/a1f411ee51bb67f60ec7d8f9da8ede5c60829587","message":"Bundle semantic provider seam","parents":["1ebb6f0d28361362725ce6885d931f566278ae20"],"sha":"a1f411ee51bb67f60ec7d8f9da8ede5c60829587"},{"author_date":"2026-09-23T14:17:02Z","committer_date":"2026-09-23T14:17:02Z","html_url":"https://github.com/BogdanAIP/chat-agent-platform/commit/84aa3af5191d18038a20ca96f84a2e4a841205eb","message":"Fix provider seam call sites","parents":["a1f411ee51bb67f60ec7d8f9da8ede5c60829587"],"sha":"84aa3af5191d18038a20ca96f84a2e4a841205eb"},{"author_date":"2026-09-23T14:17:22Z","committer_date":"2026-09-23T14:17:22Z","html_url":"https://github.com/BogdanAIP/chat-agent-platform/commit/8626626e71b59eadeef1eb6ba31ed3c73aa151c2","message":"Guard semantic provider seam package asset","parents":["84aa3af5191d18038a20ca96f84a2e4a841205eb"],"sha":"8626626e71b59eadeef1eb6ba31ed3c73aa151c2"},{"author_date":"2026-09-23T14:17:35Z","committer_date":"2026-09-23T14:17:35Z","html_url":"https://github.com/BogdanAIP/chat-agent-platform/commit/463a860068cab981731d099f2568101c56b20f70","message":"Test workspace ACK loss through provider seam","parents":["8626626e71b59eadeef1eb6ba31ed3c73aa151c2"],"sha":"463a860068cab981731d099f2568101c56b20f70"},{"author_date":"2026-09-23T14:17:38Z","committer_date":"2026-09-23T14:17:38Z","html_url":"https://github.com/BogdanAIP/chat-agent-platform/commit/e4e765a479c8e162f25bd27eb598a19625b7bb10","message":"Test browser ACK loss through provider seam","parents":["463a860068cab981731d099f2568101c56b20f70"],"sha":"e4e765a479c8e162f25bd27eb598a19625b7bb10"},{"author_date":"2026-09-23T14:18:13Z","committer_date":"2026-09-23T14:18:13Z","html_url":"https://github.com/BogdanAIP/chat-agent-platform/commit/c30009e069df4aa5c56d8dbf178d703e038ed07a","message":"Bind vision asset checks to provider seam","parents":["e4e765a479c8e162f25bd27eb598a19625b7bb10"],"sha":"c30009e069df4aa5c56d8dbf178d703e038ed07a"},{"author_date":"2026-09-23T14:21:26Z","committer_date":"2026-09-23T14:21:26Z","html_url":"https://github.com/BogdanAIP/chat-agent-platform/commit/bfb9c69cddf685b6af91807092fa712295e9c315","message":"Bind visual tool checks to bridge and provider seam","parents":["c30009e069df4aa5c56d8dbf178d703e038ed07a"],"sha":"bfb9c69cddf685b6af91807092fa712295e9c315"}],"issue_comments":[],"issue_reactions":[],"pr_number":172,"pull_request":{"base":{"ref":"research/direct-semantic-mutation-gate","repo":"BogdanAIP/chat-agent-platform","repo_id":1326588757,"repo_node_id":"R_kgDOTxIjVQ","sha":"c9fce847c0712ac913d6cb49787f892c11514fbb"},"body":"## Purpose\n\nClose the provider-coupling gap identified by the CAP Core v1 research without introducing a provider registry, generic invoke surface, new authority, or public-tool change.\n\nThis PR is stacked on #169 exact head `c9fce847c0712ac913d6cb49787f892c11514fbb`.\n\n## Scope\n\nBefore this change, `runtime/semantic-projection/bin/semantic-projection.mjs` directly owned:\n\n- resolution of `@modelcontextprotocol/server-filesystem`;\n- resolution/configuration of `@playwright/mcp`;\n- `StdioClientTransport` construction;\n- backend connection/inventory validation;\n- provider lifecycle caching/closure.\n\nThat made the semantic capability implementation also the concrete provider runtime owner.\n\nThis PR extracts only those already-existing mechanics into:\n\n`runtime/semantic-projection/lib/semantic-provider-bindings.mjs`\n\nThe seam is deliberately explicit and small:\n\n```text\ncallFilesystem(toolName, args)\ncallBrowser(toolName, args)\nbrowserClient()\nclose()\n```\n\nThere is no dynamic registry, provider discovery, arbitrary `invoke(provider,...)`, plugin loader, new persistence, new retry owner, or new authorization/verification behavior.\n\n## Authority boundary\n\nUnchanged:\n\n```text\nsemantic capability\n -> CAP authorization / expected-effect verification\n -> explicit capability-specific provider seam\n -> existing filesystem / Playwright MCP provider\n```\n\nThe provider seam does not import or own `CapabilityGrant`, `WorkingState`, Verification Kernel semantics, PASS/DONE, reconciliation, or Finish Gate.\n\n## Acceptance\n\nAdded `provider-seam-acceptance.mjs` proving:\n\n- semantic projection no longer imports direct provider packages/stdio transport;\n- the seam exposes only the four explicit operations above;\n- Files and Browser downstream allowlists stay separate;\n- cross-capability tool calls are rejected before provider startup;\n- no Core authority/state/verdict vocabulary is introduced into the provider seam.\n\nExisting semantic, six-tool, Browser verification, installed-layout, direct-tunnel and security workflows remain the behavioral regression evidence.\n\n## Sequencing\n\nThis PR must remain Draft and must not merge before #169 is accepted/merged. After the prerequisite chain is accepted, refresh/rebase this branch against the accepted Core head and rerun all applicable exact-head gates.\n\nThis PR does not implement Rust Native Host and does not change the public six-tool schema.\n","closed_at":null,"created_at":"2026-09-23T13:52:38Z","draft":true,"head":{"ref":"feature/cap-core-provider-seams","repo":"BogdanAIP/chat-agent-platform","repo_id":1326588757,"repo_node_id":"R_kgDOTxIjVQ","sha":"bfb9c69cddf685b6af91807092fa712295e9c315"},"html_url":"https://github.com/BogdanAIP/chat-agent-platform/pull/172","id":4614416704,"locked":false,"merge_commit_sha":null,"merged_at":null,"node_id":"PR_kwDOTxIjVc8AAAABEwppQA","number":172,"state":"open","title":"Core: extract explicit semantic provider seams","updated_at":"2026-09-23T14:21:27Z","user":{"id":225327645,"login":"BogdanAIP","type":"User"}},"repository":"BogdanAIP/chat-agent-platform","repository_id":1326588757,"repository_node_id":"R_kgDOTxIjVQ","review_comments":[],"reviews":[],"schema_version":"github_pr_evidence_snapshot_v1","source":{"api_base":"https://api.github.com","pull_request_url":"https://github.com/BogdanAIP/chat-agent-platform/pull/172"}}
