{"authority":{"role":"non_authoritative_source_snapshot","rules":["preserve source evidence without adjudicating truth","absence is not a negative finding","normalization and learning happen under separate governed stages"]},"commits":[{"author_date":"2026-09-04T16:22:35Z","committer_date":"2026-09-04T16:22:35Z","html_url":"https://github.com/BogdanAIP/uv-studio/commit/91885b0195e9b3e47b172d5c8631e296c674dbf6","message":"chore: close recipe entrypoint retirement lifecycle","parents":["050780d013276c3d3de9672244ad54da759f1ed3"],"sha":"91885b0195e9b3e47b172d5c8631e296c674dbf6"}],"issue_comments":[{"author_association":"NONE","body":"You have reached your Codex usage limits for code reviews. You can see your limits in the [Codex usage dashboard](https://chatgpt.com/codex/cloud/settings/usage).\nTo continue using code reviews, you can upgrade your account or add credits to your account and enable them for code reviews in your [settings](https://chatgpt.com/codex/cloud/settings/code-review).","created_at":"2026-09-04T16:23:03Z","html_url":"https://github.com/BogdanAIP/uv-studio/pull/92#issuecomment-5543424498","id":5543424498,"node_id":"IC_kwDOT0Lyms8AAAABSmnx8g","reactions":{"+1":0,"-1":0,"confused":0,"eyes":0,"heart":0,"hooray":0,"laugh":0,"rocket":0,"total_count":0,"url":"https://api.github.com/repos/BogdanAIP/uv-studio/issues/comments/5543424498/reactions"},"updated_at":"2026-09-04T16:23:03Z","user":{"id":199175422,"login":"chatgpt-codex-connector[bot]","type":"Bot"}}],"issue_reactions":[],"pr_number":92,"pull_request":{"base":{"ref":"main","repo":"BogdanAIP/uv-studio","repo_id":1329787546,"repo_node_id":"R_kgDOT0Lymg","sha":"050780d013276c3d3de9672244ad54da759f1ed3"},"body":"<!-- uv-lifecycle-closure: recipe-entrypoint-retirement -->\n<!-- uv-next-slice: execution-plan-retirement -->\n\n## Goal\n\nPerform the mechanical D-038 post-merge lifecycle closure for `recipe-entrypoint-retirement` after PR #91 merged as `050780d013276c3d3de9672244ad54da759f1ed3` from exact reviewed HEAD `6218437f78d6d8b842cda1d01f8c675147446513`.\n\n## Changes\n\n- transition `project-context/ACTIVE_SLICE.json` from `review` to `idle` with `active_slice: null`;\n- record `recipe-entrypoint-retirement` / PR #91 / merge `050780d013276c3d3de9672244ad54da759f1ed3` as `last_completed`;\n- synchronize `PROJECT_STATE.md` with the accepted recipe-entrypoint retirement result and final review/CI/merge evidence;\n- set the single next handoff to `execution-plan-retirement` and synchronize `NEXT_TASK.md` to that bounded D-070 scope.\n\nNo runtime, test, schema, API, frontend or product behavior changes are included.\n\n## Verification\n\nPR #91 received the required genuinely fresh ordinary-ChatGPT semantic review for exact `1068694fac69eb02ff6e0651855c875c532e31a7..6218437f78d6d8b842cda1d01f8c675147446513`, returning `CURRENT / PASS / 0 findings / 6 rejected candidates` under immutable BASE `.agents/skills/code-review/SKILL.md` v1.0.\n\nFinal merge-authoritative CI #4810 (`33894022998`) passed all five permanent checks on exact reviewed HEAD `6218437f78d6d8b842cda1d01f8c675147446513`, including both full unit suites, API integration, Stage4A real-media, frontend lint/audit/build and browser Product Truth on Ubuntu and Windows. PR #91 was then merged with `expected_head_sha` fixed to that reviewed HEAD.\n\nRequire the repository's five permanent CI checks on exact closure head `91885b0195e9b3e47b172d5c8631e296c674dbf6` before merge. This is a mechanical lifecycle/context closure and does not require a new independent semantic review.\n\n## Architecture impact\n\nNone. This PR records the already-merged D-070 retirement result and returns repository development memory to canonical `idle`; it introduces no new application authority.\n\n## Known limitations\n\nThis closure does not execute `/execution-plan` retirement, legacy `/projects/{id}` migration, Product Orchestrator retirement, Stage8 retirement or later D-070 work. Those remain separate bounded slices.\n\n## Next task\n\nAfter this closure merges and `main` is verified lifecycle-idle, rerun the mandatory fresh bootstrap and repository-skill discovery from that exact `main`, then open `execution-plan-retirement`. Exact-scan `/api/uv/projects/{id}/execution-plan`, `projectsApi#getProjectExecutionPlan()` and all callers, replace supported readiness with direct Production/Generation/Capability authority, and preserve remaining compatibility consumers until their own accepted retirement slices.","closed_at":"2026-09-04T16:30:49Z","created_at":"2026-09-04T16:22:59Z","draft":false,"head":{"ref":"chore/close-recipe-entrypoint-retirement","repo":"BogdanAIP/uv-studio","repo_id":1329787546,"repo_node_id":"R_kgDOT0Lymg","sha":"91885b0195e9b3e47b172d5c8631e296c674dbf6"},"html_url":"https://github.com/BogdanAIP/uv-studio/pull/92","id":4444515757,"locked":false,"merge_commit_sha":null,"merged_at":"2026-09-04T16:30:49Z","node_id":"PR_kwDOT0Lyms8AAAABCOntrQ","number":92,"state":"closed","title":"chore: close recipe entrypoint retirement lifecycle","updated_at":"2026-09-04T16:30:49Z","user":{"id":225327645,"login":"BogdanAIP","type":"User"}},"repository":"BogdanAIP/uv-studio","repository_id":1329787546,"repository_node_id":"R_kgDOT0Lymg","review_comments":[],"reviews":[],"schema_version":"github_pr_evidence_snapshot_v1","source":{"api_base":"https://api.github.com","pull_request_url":"https://github.com/BogdanAIP/uv-studio/pull/92"}}
