{"authority":{"role":"non_authoritative_source_snapshot","rules":["preserve source evidence without adjudicating truth","absence is not a negative finding","normalization and learning happen under separate governed stages"]},"commits":[{"author_date":"2026-09-12T22:47:09Z","committer_date":"2026-09-12T22:47:09Z","html_url":"https://github.com/BogdanAIP/chat-agent-platform/commit/92d50c090302a1f9a2a0169489420588f313fe54","message":"Tests: add delegation provider contract guard","parents":["e334653b62f268e185145121b2b922a9b2edf0cc"],"sha":"92d50c090302a1f9a2a0169489420588f313fe54"}],"issue_comments":[{"author_association":"NONE","body":"You have reached your Codex usage limits for code reviews. You can see your limits in the [Codex usage dashboard](https://chatgpt.com/codex/cloud/settings/usage).\nTo continue using code reviews, you can upgrade your account or add credits to your account and enable them for code reviews in your [settings](https://chatgpt.com/codex/cloud/settings/code-review).","created_at":"2026-09-12T22:47:39Z","html_url":"https://github.com/BogdanAIP/chat-agent-platform/pull/156#issuecomment-5649202463","id":5649202463,"node_id":"IC_kwDOTxIjVc8AAAABULf9Hw","reactions":{"+1":0,"-1":0,"confused":0,"eyes":0,"heart":0,"hooray":0,"laugh":0,"rocket":0,"total_count":0,"url":"https://api.github.com/repos/BogdanAIP/chat-agent-platform/issues/comments/5649202463/reactions"},"updated_at":"2026-09-12T22:47:39Z","user":{"id":199175422,"login":"chatgpt-codex-connector[bot]","type":"Bot"}}],"issue_reactions":[],"pr_number":156,"pull_request":{"base":{"ref":"main","repo":"BogdanAIP/chat-agent-platform","repo_id":1326588757,"repo_node_id":"R_kgDOTxIjVQ","sha":"e334653b62f268e185145121b2b922a9b2edf0cc"},"body":"## Summary\n\nAdds a contract guard test for the Delegation Provider Contract introduced in PR #155.\n\n## Scope\n\n- verifies the contract file exists;\n- verifies CAP ownership boundaries remain explicit;\n- verifies providers remain execution-only;\n- verifies provider result is not treated as verified external effect;\n- verifies the contract does not define orchestration/runtime concerns.\n\n## Validation\n\nRan:\n\n`python -m unittest tests/test_delegation_provider_contract_guard.py`\n\nResult: OK (5 tests passed).","closed_at":"2026-09-12T22:50:56Z","created_at":"2026-09-12T22:47:34Z","draft":false,"head":{"ref":"test/delegation-provider-contract-guard","repo":"BogdanAIP/chat-agent-platform","repo_id":1326588757,"repo_node_id":"R_kgDOTxIjVQ","sha":"92d50c090302a1f9a2a0169489420588f313fe54"},"html_url":"https://github.com/BogdanAIP/chat-agent-platform/pull/156","id":4515854533,"locked":false,"merge_commit_sha":null,"merged_at":"2026-09-12T22:50:56Z","node_id":"PR_kwDOTxIjVc8AAAABDSp4xQ","number":156,"state":"closed","title":"Tests: add delegation provider contract guard","updated_at":"2026-09-12T22:50:56Z","user":{"id":225327645,"login":"BogdanAIP","type":"User"}},"repository":"BogdanAIP/chat-agent-platform","repository_id":1326588757,"repository_node_id":"R_kgDOTxIjVQ","review_comments":[],"reviews":[],"schema_version":"github_pr_evidence_snapshot_v1","source":{"api_base":"https://api.github.com","pull_request_url":"https://github.com/BogdanAIP/chat-agent-platform/pull/156"}}
