{"authority":{"role":"non_authoritative_source_snapshot","rules":["preserve source evidence without adjudicating truth","absence is not a negative finding","normalization and learning happen under separate governed stages"]},"commits":[{"author_date":"2026-09-01T15:02:02Z","committer_date":"2026-09-01T15:02:02Z","html_url":"https://github.com/BogdanAIP/chat-agent-platform/commit/b7ce6366170cc7e8768929e6a12c457a3672d28d","message":"Experiment fixture: evolve claim result contract","parents":["8f019b47d0a49ba343a6a90ea761e55b9b364227"],"sha":"b7ce6366170cc7e8768929e6a12c457a3672d28d"}],"issue_comments":[],"issue_reactions":[],"pr_number":148,"pull_request":{"base":{"ref":"exp/reviewer-snapshot-crossfile-base","repo":"BogdanAIP/chat-agent-platform","repo_id":1326588757,"repo_node_id":"R_kgDOTxIjVQ","sha":"8f019b47d0a49ba343a6a90ea761e55b9b364227"},"body":"## Experiment-only reviewer-context control\n\nThis Draft PR exists only to test whether an isolated Temporary Chat reviewer can discover semantic impact across changed and unchanged repository files when its repository evidence is delivered through a remote-verified whole-repository snapshot.\n\nThe control intentionally provides no expected finding, severity, category or semantic conclusion to the reviewer.\n\nExpected structural property for the harness: the PR changes exactly one source file relative to the experiment base branch; related unchanged repository files remain available only through the whole-repository snapshot.\n\nDo not merge this PR. It will be closed after the physical context experiment.","closed_at":null,"created_at":"2026-09-01T15:02:19Z","draft":true,"head":{"ref":"exp/reviewer-snapshot-crossfile-head","repo":"BogdanAIP/chat-agent-platform","repo_id":1326588757,"repo_node_id":"R_kgDOTxIjVQ","sha":"b7ce6366170cc7e8768929e6a12c457a3672d28d"},"html_url":"https://github.com/BogdanAIP/chat-agent-platform/pull/148","id":4413461340,"locked":false,"merge_commit_sha":null,"merged_at":null,"node_id":"PR_kwDOTxIjVc8AAAABBxATXA","number":148,"state":"open","title":"Experiment control: cross-file reviewer context","updated_at":"2026-09-01T15:02:19Z","user":{"id":225327645,"login":"BogdanAIP","type":"User"}},"repository":"BogdanAIP/chat-agent-platform","repository_id":1326588757,"repository_node_id":"R_kgDOTxIjVQ","review_comments":[],"reviews":[],"schema_version":"github_pr_evidence_snapshot_v1","source":{"api_base":"https://api.github.com","pull_request_url":"https://github.com/BogdanAIP/chat-agent-platform/pull/148"}}
