{"authority":{"role":"non_authoritative_source_snapshot","rules":["preserve source evidence without adjudicating truth","absence is not a negative finding","normalization and learning happen under separate governed stages"]},"commits":[{"author_date":"2026-09-04T18:05:54Z","committer_date":"2026-09-04T18:05:54Z","html_url":"https://github.com/BogdanAIP/uv-studio/commit/0ba8a93984bd508eb8e045b741286bca476906c8","message":"chore: close execution plan retirement lifecycle","parents":["c8915e2aede2125136080156513ffc3bd4727038"],"sha":"0ba8a93984bd508eb8e045b741286bca476906c8"},{"author_date":"2026-09-04T18:07:08Z","committer_date":"2026-09-04T18:07:08Z","html_url":"https://github.com/BogdanAIP/uv-studio/commit/e3596b217f70d729465d637a7b30d3bd054b1657","message":"chore: fix lifecycle closure markers","parents":["0ba8a93984bd508eb8e045b741286bca476906c8"],"sha":"e3596b217f70d729465d637a7b30d3bd054b1657"}],"issue_comments":[{"author_association":"NONE","body":"You have reached your Codex usage limits for code reviews. You can see your limits in the [Codex usage dashboard](https://chatgpt.com/codex/cloud/settings/usage).\nTo continue using code reviews, you can upgrade your account or add credits to your account and enable them for code reviews in your [settings](https://chatgpt.com/codex/cloud/settings/code-review).","created_at":"2026-09-04T18:06:16Z","html_url":"https://github.com/BogdanAIP/uv-studio/pull/94#issuecomment-5544572667","id":5544572667,"node_id":"IC_kwDOT0Lyms8AAAABSnt2-w","reactions":{"+1":0,"-1":0,"confused":0,"eyes":0,"heart":0,"hooray":0,"laugh":0,"rocket":0,"total_count":0,"url":"https://api.github.com/repos/BogdanAIP/uv-studio/issues/comments/5544572667/reactions"},"updated_at":"2026-09-04T18:06:16Z","user":{"id":199175422,"login":"chatgpt-codex-connector[bot]","type":"Bot"}}],"issue_reactions":[],"pr_number":94,"pull_request":{"base":{"ref":"main","repo":"BogdanAIP/uv-studio","repo_id":1329787546,"repo_node_id":"R_kgDOT0Lymg","sha":"c8915e2aede2125136080156513ffc3bd4727038"},"body":"<!-- uv-lifecycle-closure: execution-plan-retirement -->\n<!-- uv-next-slice: legacy-direction-tool-migration -->\n\n## Goal\n\nPerform the mandatory D-038 context-only closure after accepted and merged PR #93 and return repository lifecycle to `idle`.\n\n## Changes\n\n- clear `active_slice` and set lifecycle state to `idle`;\n- record `execution-plan-retirement` PR #93 merge `c8915e2aede2125136080156513ffc3bd4727038` as last completed;\n- hand off to the accepted D-070 legacy direction/tool migration sequence without starting a new product slice;\n- update `PROJECT_STATE.md` and `NEXT_TASK.md` for the post-merge idle handoff.\n\n## Verification\n\nPR #93 merged exact reviewed HEAD `01095095fbdabfdbf840063f10e968ad0c305d14` after fresh `PASS/CURRENT` with zero findings and exact-head permanent CI 5/5. This closure changes only `project-context/ACTIVE_SLICE.json`, `PROJECT_STATE.md`, and `NEXT_TASK.md`; exact closure-head permanent CI is required before merge.\n\n## Architecture impact\n\nNone. Runtime, frontend, tests, architecture authorities, persisted project behavior and product semantics are unchanged. The closure only records accepted history and lifecycle state.\n\n## Known limitations\n\nThis PR does not select or implement the next concrete legacy migration responsibility group. Product Orchestrator, internal Recipe Registry, legacy `/projects/{id}` compatibility, Stage8 and the `micro_drama` golden vertical remain separately scheduled work.\n\n## Next task\n\nAfter this closure merges, bootstrap from lifecycle-closed `main`, reconstruct exact live callers for legacy direction/tool composition, and choose one bounded responsibility group before opening the next product slice.","closed_at":"2026-09-04T18:15:16Z","created_at":"2026-09-04T18:06:11Z","draft":false,"head":{"ref":"chore/close-execution-plan-retirement","repo":"BogdanAIP/uv-studio","repo_id":1329787546,"repo_node_id":"R_kgDOT0Lymg","sha":"e3596b217f70d729465d637a7b30d3bd054b1657"},"html_url":"https://github.com/BogdanAIP/uv-studio/pull/94","id":4445299416,"locked":false,"merge_commit_sha":null,"merged_at":"2026-09-04T18:15:16Z","node_id":"PR_kwDOT0Lyms8AAAABCPXi2A","number":94,"state":"closed","title":"chore: close execution plan retirement lifecycle","updated_at":"2026-09-04T18:15:16Z","user":{"id":225327645,"login":"BogdanAIP","type":"User"}},"repository":"BogdanAIP/uv-studio","repository_id":1329787546,"repository_node_id":"R_kgDOT0Lymg","review_comments":[],"reviews":[],"schema_version":"github_pr_evidence_snapshot_v1","source":{"api_base":"https://api.github.com","pull_request_url":"https://github.com/BogdanAIP/uv-studio/pull/94"}}
