{"authority":{"role":"non_authoritative_source_snapshot","rules":["preserve source evidence without adjudicating truth","absence is not a negative finding","normalization and learning happen under separate governed stages"]},"commits":[{"author_date":"2026-09-22T06:04:11Z","committer_date":"2026-09-22T06:04:11Z","html_url":"https://github.com/BogdanAIP/chat-agent-platform/commit/dd65ee526e4b5b6f05e5a8d7aa3f6e49e6cb9cba","message":"Docs: record CAP Dreams replay architecture","parents":["24ed938c587c9d3e2288c92bc156ccc476c955f3"],"sha":"dd65ee526e4b5b6f05e5a8d7aa3f6e49e6cb9cba"}],"issue_comments":[],"issue_reactions":[{"content":"+1","created_at":"2026-09-22T06:07:44Z","id":518366696,"node_id":"REA_lAHOTxIjVc8AAAABSfbjtM4e5aXo","user":{"id":199175422,"login":"chatgpt-codex-connector[bot]","type":"User"}}],"pr_number":162,"pull_request":{"base":{"ref":"main","repo":"BogdanAIP/chat-agent-platform","repo_id":1326588757,"repo_node_id":"R_kgDOTxIjVQ","sha":"24ed938c587c9d3e2288c92bc156ccc476c955f3"},"body":"## Goal\n\nRecord the CAP Dreams idea in the existing long-horizon architecture owner without changing the current product roadmap or production runtime.\n\n## What this adds\n\n- defines CAP Dreams as a future shadow-first, read-only/offline improvement layer;\n- maps verified CAP execution history into conceptual `DreamEpisodeV1` / `ReplayWorldV1` / `DreamPolicyV1` / `DreamEvaluationV1` artifacts;\n- keeps replay exact only over observed outcomes and marks unvisited branches as `UNSEEN`;\n- routes any useful result back through the existing `CANDIDATE -> VERIFIED | REJECTED | STALE` lifecycle;\n- preserves Control Plane, Verification Kernel, Finish Gate, grants, persistence/reconciliation invariants and security policy as non-optimizable authority boundaries;\n- identifies Stage 26.4 skill/procedure candidate improvement as the first likely consumer;\n- records Dream-RSI (arXiv:2609.14858) as fresh external motivation for history-as-replay.\n\n## Explicit non-goals\n\n- no production code;\n- no `ROADMAP.md` or `CURRENT_STATE.md` change;\n- no new public tool;\n- no EventBus or scheduler;\n- no second general planner;\n- no widening of `chatgpt-temporary`;\n- no production self-modifying loop.\n\nAny concrete implementation remains blocked on fresh repository Stage Research / source-code research.","closed_at":null,"created_at":"2026-09-22T06:04:27Z","draft":false,"head":{"ref":"docs/cap-dreams-replay-architecture","repo":"BogdanAIP/chat-agent-platform","repo_id":1326588757,"repo_node_id":"R_kgDOTxIjVQ","sha":"dd65ee526e4b5b6f05e5a8d7aa3f6e49e6cb9cba"},"html_url":"https://github.com/BogdanAIP/chat-agent-platform/pull/162","id":4598961818,"locked":false,"merge_commit_sha":null,"merged_at":null,"node_id":"PR_kwDOTxIjVc8AAAABEh6Wmg","number":162,"state":"open","title":"Docs: record CAP Dreams replay architecture","updated_at":"2026-09-22T06:04:27Z","user":{"id":225327645,"login":"BogdanAIP","type":"User"}},"repository":"BogdanAIP/chat-agent-platform","repository_id":1326588757,"repository_node_id":"R_kgDOTxIjVQ","review_comments":[],"reviews":[],"schema_version":"github_pr_evidence_snapshot_v1","source":{"api_base":"https://api.github.com","pull_request_url":"https://github.com/BogdanAIP/chat-agent-platform/pull/162"}}
