{"authority":{"role":"non_authoritative_source_snapshot","rules":["preserve source evidence without adjudicating truth","absence is not a negative finding","normalization and learning happen under separate governed stages"]},"commits":[{"author_date":"2026-09-18T09:29:19Z","committer_date":"2026-09-18T09:29:19Z","html_url":"https://github.com/BogdanAIP/chat-agent-platform/commit/c66335cd1c535c3f520895c1fc52e10b6b8f25b2","message":"docs: define harness and AI as separate architecture axes","parents":["24ed938c587c9d3e2288c92bc156ccc476c955f3"],"sha":"c66335cd1c535c3f520895c1fc52e10b6b8f25b2"},{"author_date":"2026-09-18T09:29:21Z","committer_date":"2026-09-18T09:29:21Z","html_url":"https://github.com/BogdanAIP/chat-agent-platform/commit/bc5183e1665cdb1350a806e023714c3098c1d250","message":"docs: clarify provider harness versus inference ownership","parents":["c66335cd1c535c3f520895c1fc52e10b6b8f25b2"],"sha":"bc5183e1665cdb1350a806e023714c3098c1d250"},{"author_date":"2026-09-18T09:29:25Z","committer_date":"2026-09-18T09:29:25Z","html_url":"https://github.com/BogdanAIP/chat-agent-platform/commit/2b5f0a6675724aabcbd442d70c91eed8d1f13589","message":"docs: record future harness by AI binding seam","parents":["bc5183e1665cdb1350a806e023714c3098c1d250"],"sha":"2b5f0a6675724aabcbd442d70c91eed8d1f13589"}],"issue_comments":[{"author_association":"NONE","body":"You have reached your Codex usage limits for code reviews. You can see your limits in the [Codex usage dashboard](https://chatgpt.com/codex/cloud/settings/usage).\nTo continue using code reviews, you can upgrade your account or add credits to your account and enable them for code reviews in your [settings](https://chatgpt.com/codex/cloud/settings/code-review).","created_at":"2026-09-18T09:29:51Z","html_url":"https://github.com/BogdanAIP/chat-agent-platform/pull/160#issuecomment-5728067336","id":5728067336,"node_id":"IC_kwDOTxIjVc8AAAABVWtfCA","reactions":{"+1":0,"-1":0,"confused":0,"eyes":0,"heart":0,"hooray":0,"laugh":0,"rocket":0,"total_count":0,"url":"https://api.github.com/repos/BogdanAIP/chat-agent-platform/issues/comments/5728067336/reactions"},"updated_at":"2026-09-18T09:29:51Z","user":{"id":199175422,"login":"chatgpt-codex-connector[bot]","type":"Bot"}}],"issue_reactions":[],"pr_number":160,"pull_request":{"base":{"ref":"main","repo":"BogdanAIP/chat-agent-platform","repo_id":1326588757,"repo_node_id":"R_kgDOTxIjVQ","sha":"24ed938c587c9d3e2288c92bc156ccc476c955f3"},"body":"## Goal\n\nMake the long-horizon CAP architecture explicit without changing current runtime authority:\n\n- harness/runtime choice and AI/inference-source choice are separate architectural axes;\n- ordinary ChatGPT remains the current general planner;\n- CAP owns binding authority, identity, correlation, budgets and verification;\n- harnesses do not silently switch AI sources without explicit planner-authorized routing/fallback;\n- mature provider-compatible APIs/gateways should be reused instead of rebuilding vendor inference stacks;\n- this does **not** authorize a generic AI/provider framework today.\n\n## Scope\n\nDocumentation only:\n- `project-context/ARCHITECTURE.md`\n- `project-context/DELEGATION_PROVIDER_CONTRACT.md`\n- `project-context/ROADMAP.md`\n\nNo public tool, runtime, authority, provider implementation or release ordering is changed.","closed_at":null,"created_at":"2026-09-18T09:29:46Z","draft":false,"head":{"ref":"docs/harness-ai-separation","repo":"BogdanAIP/chat-agent-platform","repo_id":1326588757,"repo_node_id":"R_kgDOTxIjVQ","sha":"2b5f0a6675724aabcbd442d70c91eed8d1f13589"},"html_url":"https://github.com/BogdanAIP/chat-agent-platform/pull/160","id":4567401188,"locked":false,"merge_commit_sha":null,"merged_at":null,"node_id":"PR_kwDOTxIjVc8AAAABED0C5A","number":160,"state":"open","title":"Docs: separate harness runtime from AI inference source","updated_at":"2026-09-18T09:29:51Z","user":{"id":225327645,"login":"BogdanAIP","type":"User"}},"repository":"BogdanAIP/chat-agent-platform","repository_id":1326588757,"repository_node_id":"R_kgDOTxIjVQ","review_comments":[],"reviews":[],"schema_version":"github_pr_evidence_snapshot_v1","source":{"api_base":"https://api.github.com","pull_request_url":"https://github.com/BogdanAIP/chat-agent-platform/pull/160"}}
