{"authority":{"role":"non_authoritative_source_snapshot","rules":["preserve source evidence without adjudicating truth","absence is not a negative finding","normalization and learning happen under separate governed stages"]},"commits":[{"author_date":"2026-09-19T06:51:43Z","committer_date":"2026-09-19T06:51:43Z","html_url":"https://github.com/BogdanAIP/chat-agent-platform/commit/f0be0e1e124e9176758d6d83806ca803b7f5d9e6","message":"Research BrowserSkill as narrow CAP browser provider","parents":["24ed938c587c9d3e2288c92bc156ccc476c955f3"],"sha":"f0be0e1e124e9176758d6d83806ca803b7f5d9e6"},{"author_date":"2026-09-19T07:08:36Z","committer_date":"2026-09-19T07:08:36Z","html_url":"https://github.com/BogdanAIP/chat-agent-platform/commit/fd1c56f7aaeb5a9f324c0e3cc45951a684ca4451","message":"Research: preserve full BrowserSkill capability target","parents":["f0be0e1e124e9176758d6d83806ca803b7f5d9e6"],"sha":"fd1c56f7aaeb5a9f324c0e3cc45951a684ca4451"}],"issue_comments":[],"issue_reactions":[],"pr_number":161,"pull_request":{"base":{"ref":"main","repo":"BogdanAIP/chat-agent-platform","repo_id":1326588757,"repo_node_id":"R_kgDOTxIjVQ","sha":"24ed938c587c9d3e2288c92bc156ccc476c955f3"},"body":"## Purpose\n\nResearch whether Tencent BrowserSkill can become a **full-capability Browser provider family under CAP authority** for real logged-in Chromium use, while preserving CAP authorization/verification.\n\nStage Research decision: **NARROW — implementation sequence only**.\n\nThis does **not** mean \"trim BrowserSkill to a tiny subset\". The research now carries an explicit capability-preservation contract: every BrowserSkill feature family stays visible as `FIRST_SLICE`, `TRACKED_NEXT`, `BLOCKED_WITH_REASON`, or `REJECTED_BY_REVIEWED_DECISION`. Omission from an early experiment cannot silently become a permanent product boundary.\n\n## Long-horizon direction\n\n```text\nordinary ChatGPT\n -> CAP semantic / consequence surface\n -> CAP Control Plane / Browser capability\n -> BrowserSkill provider\n -> real Chromium profile\n```\n\nPlaywright remains an accepted isolated provider, but BrowserSkill is not defined as a permanently reduced fallback.\n\n## Capability preservation\n\nThe tracked target inventory now explicitly includes:\n\n- session start/stop/list;\n- navigation/history/wait;\n- observe/snapshot/HTML/screenshot/console/network;\n- click/fill/hover/wheel/scroll/focus/blur/select/press;\n- tab list/create/select/close;\n- **borrow existing user tab + return** as a core authenticated-browser target;\n- resize/emulation;\n- request-help / human handoff;\n- upload/drop-upload/download;\n- multiple connected browsers and explicit instance/profile selection;\n- remote/server mode;\n- evaluate/raw page script;\n- record/trace capture;\n- BrowserSkill audit/effect metadata.\n\nNothing in that inventory is rejected by this brief. Higher-authority items can be blocked pending security/authority research, but they stay tracked.\n\nThe current CAP six-tool surface is also explicitly **not an eternal ceiling**. If tabs, file transfer, human assistance or another BrowserSkill consequence class cannot be represented truthfully through current semantics, CAP should review a truthful public-surface extension instead of hiding or deleting the capability.\n\n## First executable slice\n\nThe first physical proof is intentionally small only to isolate failures:\n\n```text\nCAP\n -> BrowserSkill-created Agent Window\n -> navigate\n -> observe\n -> one bounded interaction\n -> observe again\n -> CAP verification\n -> stop\n```\n\nThat first slice is **not the product boundary**. The next acceptance slice is required to address existing-user-tab borrow/return and its denial/timeout/crash/cleanup behavior once the local peer-authentication and lifecycle gates are satisfied.\n\n## Important security finding\n\nBrowserSkill v0.3.0 is pinned to exact upstream commit\n`75e2c64abaf4b7cc75682d94b0c1fd5db0cbd5e5`.\n\nIts local WebSocket peer gate accepts any extension-shaped Chrome origin rather than authenticating the exact BrowserSkill extension. Open upstream reports #273/#118 document the same boundary. That blocks **production logged-in-profile authority** until resolved, but it is recorded as a security block, not a rejection of BrowserSkill capabilities.\n\n## Scope\n\nResearch/documentation only. No runtime, dependency, public tool, authority implementation or release ordering is changed.\n\nThis PR does not displace the current roadmap or PR #159. Any implementation invocation must rerun repository bootstrap against the then-live repository state, and every later BrowserSkill integration PR must update the capability matrix so features cannot disappear by omission.","closed_at":null,"created_at":"2026-09-19T06:51:52Z","draft":true,"head":{"ref":"research/browserskill-cap-adapter","repo":"BogdanAIP/chat-agent-platform","repo_id":1326588757,"repo_node_id":"R_kgDOTxIjVQ","sha":"fd1c56f7aaeb5a9f324c0e3cc45951a684ca4451"},"html_url":"https://github.com/BogdanAIP/chat-agent-platform/pull/161","id":4576243363,"locked":false,"merge_commit_sha":null,"merged_at":null,"node_id":"PR_kwDOTxIjVc8AAAABEMPuow","number":161,"state":"open","title":"Research: BrowserSkill under CAP with full capability preservation","updated_at":"2026-09-19T07:08:57Z","user":{"id":225327645,"login":"BogdanAIP","type":"User"}},"repository":"BogdanAIP/chat-agent-platform","repository_id":1326588757,"repository_node_id":"R_kgDOTxIjVQ","review_comments":[],"reviews":[],"schema_version":"github_pr_evidence_snapshot_v1","source":{"api_base":"https://api.github.com","pull_request_url":"https://github.com/BogdanAIP/chat-agent-platform/pull/161"}}
