{"authority":{"role":"non_authoritative_source_snapshot","rules":["preserve source evidence without adjudicating truth","absence is not a negative finding","normalization and learning happen under separate governed stages"]},"commits":[{"author_date":"2026-09-22T08:20:09Z","committer_date":"2026-09-22T08:20:09Z","html_url":"https://github.com/BogdanAIP/chat-agent-platform/commit/88ded62b1922bdad476f2d0d31436745e95a3697","message":"docs: record typed decision provider research candidate","parents":["24ed938c587c9d3e2288c92bc156ccc476c955f3"],"sha":"88ded62b1922bdad476f2d0d31436745e95a3697"}],"issue_comments":[],"issue_reactions":[{"content":"+1","created_at":"2026-09-22T08:24:02Z","id":518532825,"node_id":"REA_lAHOTxIjVc8AAAABSgiZJs4e6C7Z","user":{"id":199175422,"login":"chatgpt-codex-connector[bot]","type":"User"}}],"pr_number":163,"pull_request":{"base":{"ref":"main","repo":"BogdanAIP/chat-agent-platform","repo_id":1326588757,"repo_node_id":"R_kgDOTxIjVQ","sha":"24ed938c587c9d3e2288c92bc156ccc476c955f3"},"body":"## Summary\n\nRecords a future research candidate for a provider-neutral typed Decision Provider role, motivated by Jev / TypeSafe System One and the open local Laya model family.\n\nThis is intentionally documentation-only:\n\n- no runtime code;\n- no provider API;\n- no roadmap change;\n- no authority change;\n- no accepted architecture decision.\n\nThe note explicitly preserves the existing planner / Control Plane / Verification Kernel / Finish Gate boundaries and requires fresh Stage Research before any production implementation.\n\n## Scope\n\nAdds only:\n\n`project-context/DECISION_PROVIDER_RESEARCH_CANDIDATE.md`\n\n## Validation\n\nCompared against `main@24ed938c587c9d3e2288c92bc156ccc476c955f3`: one added documentation file, 195 additions, 0 deletions.","closed_at":null,"created_at":"2026-09-22T08:20:30Z","draft":false,"head":{"ref":"docs/decision-provider-research-candidate","repo":"BogdanAIP/chat-agent-platform","repo_id":1326588757,"repo_node_id":"R_kgDOTxIjVQ","sha":"88ded62b1922bdad476f2d0d31436745e95a3697"},"html_url":"https://github.com/BogdanAIP/chat-agent-platform/pull/163","id":4599937127,"locked":false,"merge_commit_sha":null,"merged_at":null,"node_id":"PR_kwDOTxIjVc8AAAABEi14Zw","number":163,"state":"open","title":"docs: record typed Decision Provider research candidate","updated_at":"2026-09-22T08:20:30Z","user":{"id":225327645,"login":"BogdanAIP","type":"User"}},"repository":"BogdanAIP/chat-agent-platform","repository_id":1326588757,"repository_node_id":"R_kgDOTxIjVQ","review_comments":[],"reviews":[],"schema_version":"github_pr_evidence_snapshot_v1","source":{"api_base":"https://api.github.com","pull_request_url":"https://github.com/BogdanAIP/chat-agent-platform/pull/163"}}
